,sentence,task,label,encoded,output,target
2442,Experiments on adversarial robustness can be further improved.,fine,arg-request_experiment,2.0,2,2
2443,(1) the settings and the analysis of adversarial robustness experiment can be discussed in details.,fine,arg-request_edit,1.0,9,1
2444,"For example, how to build ''adversarial learning baseline'' in meta learning settings and why the result implies the perturbation directions for generalization and robustness relates to each other; (2) how other regularization methods (e.g., Mixup, VIB and Information dropout) perform on adversarial robustness? Does Meta dropout performs better than them?",fine,arg-request_explanation,3.0,9,3
2445,"(3) FGSM is a quite weak adversarial attack method, which makes evaluating adversarial robustness on FGSM may be misleading.",fine,none,9.0,9,9
2446,"I suggest trying some other STOA attack methods (e.g., iterative methods).",fine,arg-request_experiment,2.0,2,2
2447,Some typos:,fine,arg-structuring_heading,6.0,6,6
2448,"Page 3, Regularization methods, 3rd line, ````wwwdiscuss",fine,arg-request_typo,5.0,9,5
2449,"Page 7, 2nd line from the bottom, FSGM->FGSM",fine,arg-request_typo,5.0,5,5
2450,I read the other reviewers' comments as well as the rebuttal.,fine,none,9.0,9,9
2451,"I think that the other reviewers make a number of valid points, especially with regards to the theoretical analysis of the paper.",fine,none,9.0,9,9
2452,"Therefore, I do not feel confident in championing this paper.",fine,none,9.0,9,9
2453,PS: I am downgrading my confidence in my evaluation.,fine,none,9.0,9,9
2454,---,fine,arg-structuring_heading,6.0,6,6
2455,Paper 93 proposes an empirical evaluation of the memorization properties of convnets.,fine,arg-structuring_summary,8.0,8,8
2456,"More specifically, it evaluates three aspects:",fine,arg-structuring_heading,6.0,6,6
2457,-,fine,arg-structuring_heading,6.0,6,6
2458,First it evaluates whether convnets can learn to distinguish images from two different sets by training a binary classifier.,fine,arg-structuring_summary,8.0,8,8
2459,"The conclusion is that, indeed, deep convnets can learn to make such a decision. As could be guessed from intuition, the larger the capacity of the network and the smaller the size of the sets, the higher the accuracy.",fine,arg-structuring_summary,8.0,8,8
2460,-,fine,arg-structuring_heading,6.0,6,6
2461,"Second, it evaluates whether we can detect that a group of samples of a dataset was used to train a model.",fine,arg-structuring_summary,8.0,8,8
2462,"For this purpose, it is proposed to compute the distribution of maximal activation scores of the output softmax layer and to make use of the Kolmogorov-Smirov distance between the cumulative distributions.",fine,arg-structuring_summary,8.0,8,8
2463,It is shown experimentally that one can detect (even partial) leakage with such a technique.,fine,arg-structuring_summary,8.0,8,8
2464,-,fine,arg-structuring_heading,6.0,6,6
2465,"Third, it evaluates whether we can detect that a single images was used to train a convnet.",fine,arg-structuring_summary,8.0,8,8
2466,Two simple techniques are proposed.,fine,arg-structuring_summary,8.0,8,8
2467,The first one considers that a sample is part of the training set if it correctly classified.,fine,arg-structuring_summary,8.0,8,8
2468,The second one considers that a sample is part of the training set if its loss is below a threshold.,fine,arg-structuring_summary,8.0,8,8
2469,It is shown experimentally that one can make such a decision with moderate accuracy.,fine,arg-structuring_summary,8.0,8,8
2470,On the positive side:,fine,arg-structuring_heading,6.0,6,6
2471,-	This is a topic that should be of broad interest to the ICLR community.,fine,none,9.0,9,9
2472,-	The paper is generally well-written.,fine,none,9.0,9,9
2473,-	The experiments are reported on large-scale datasets on high-capacity networks which is more realistic than small-scale settings.,fine,none,9.0,9,9
2474,On the negative side:,fine,arg-structuring_heading,6.0,6,6
2475,-,fine,arg-structuring_heading,6.0,6,6
2476,It is unclear whether the data augmentation techniques is applied only at training time or also at test time.,fine,none,9.0,9,9
2477,"In other words: at test time, do you present the original images only or transformed images too?",fine,arg-request_explanation,3.0,3,3
2478,"-	In section 4, it is unclear why only the maximal activation of the softmax layer is used to characterize a sample? Why not considering the full distribution that should contain richer information? Why just focusing on the output layer and why not using the info available at intermediate layers?",fine,arg-request_explanation,3.0,3,3
2479,-	Section 5 is somewhat less clear than the previous sections.,fine,none,9.0,9,9
2480,"The authors should more clearly define what the private, public and evaluation sets are, right from the beginning.",fine,arg-request_edit,1.0,1,1
2481,The purpose of the public set is explained only in section 5.2.,fine,none,9.0,9,9
2482,-	The experimental results of section 5.2 are somewhat disappointing.,fine,none,9.0,9,9
2483,"Even with no data augmentation, and even with the original networks, membership can only be assessed with a 90% accuracy.",fine,none,9.0,9,9
2484,"Results are much lower in less favorable cases, sometimes close to random (see last line of Table 3).",fine,none,9.0,9,9
2485,This seems to be too low to be of practical use.,fine,none,9.0,9,9
2486,This might be because the Bayes and MAT attacks are too simplistic.,fine,none,9.0,9,9
2487,"Again, why not using the distribution of the outputs of all layers? Why focusing only on the output of the last layer?",fine,arg-request_explanation,3.0,3,3
2488,The authors argue that not knowing the distribution of rewards observed in the policy gradient algorithm hinders learning (and the tuning process).,fine,arg-structuring_summary,8.0,8,8
2489,"They propose to replace the reward term in the policy gradient algorithm with its centered empirical cumulative distribution, which has a fixed and known U[-1, 1] distribution.",fine,arg-structuring_summary,8.0,8,8
2490,"They test their methods on a toy task that consists in finding inclusion maximal cliques (which tests for local optimality) against REINFORCE (including their variants: centering the rewards with a mean baseline or normalizing them), the cross-entropy method and Exp3.",fine,arg-structuring_summary,8.0,8,8
2491,I think that the current draft lacks strong experimental results to properly demonstrate the usefulness of the method.,fine,none,9.0,9,9
2492,"The method is only evaluated on a single task and many confounding variables (the design of the reward function, factorizing the parametric distribution into marginals, reporting results for a single (non-tuned?) learning rate, etc.) make evaluation difficult.",fine,none,9.0,9,9
2493,The usefulness of the approach is also lessened by the greater importance of the choice of the optimizer.,fine,none,9.0,9,9
2494,I would like the method to be applied on other domains such as continuous non-convex optimization and reinforcement learning.,fine,arg-request_experiment,2.0,2,2
2495,"Additionally, I find the motivation for caring about local optimality unconvincing.",fine,none,9.0,9,9
2496,I take exception that people care more about local optimality than the actual objective.,fine,none,9.0,9,9
2497,"From a practical point of view, local optimality is a mean (that can be achieved via heuristic algorithms) to an end (the objective itself).",fine,none,9.0,9,9
2498,"This also holds for k-means, which is usually run multiple times with different starting conditions.",fine,none,9.0,9,9
2499,Some comments:,fine,arg-structuring_heading,6.0,6,6
2500,- Table 3 is a bit confusing as-is (lower is only better when controlling on the quality of the best sample.,fine,none,9.0,9,9
2501,e.g: REINFORCE has lower best-sample to total-sample ratio but its solutions are worse),fine,none,9.0,9,9
2502,- It isn't clear from the tables that OCE_0.1 outperforms REINFORCE_Z (as is mentioned in the discussion).,fine,none,9.0,9,9
2503,"- The paper should refer to 1) the reward shaping literature, 2) the growing line of works concerned with control variates for REINFORCE (such as VIMCO, MuProp, REBAR) and 3) the growing line of works concerned about combinatorial optimization with reinforcement learning (Neural Combinatorial Optimization with Reinforcement Learning, etc.)",fine,arg-request_edit,1.0,1,1
2504,- I would also encourage the authors to come up with a more descriptive name for the approach.,fine,arg-request_edit,1.0,2,1
2505,* Strengths:,fine,arg-structuring_heading,6.0,6,6
2506,- The paper gives theoretical insight into why Batch Normalization is useful in making neural network training more robust and is therefore an important contribution to the literature.,fine,arg-structuring_summary,8.0,8,8
2507,"- While the actual arguments are somewhat technical as is expected from such a paper, the motivation and general strategy is very easy to follow and insightful.",fine,none,9.0,9,9
2508,* Weaknesses:,fine,arg-structuring_heading,6.0,6,6
2509,"- The bounds do not immediately apply in the batch normalization setting as used by neural network practitioners, however there are practical ways to link the two settings as pointed out in section 2.4",fine,none,9.0,9,9
2510,"- As the authors point out, the idea of using a batch-normalization like strategy to set an adaptive learning rate has already been explored in the WNGrad paper.",fine,arg-structuring_quote,7.0,9,7
2511,However it is valuable to have a similar analysis closer to the batch normalization setting used by most practitioners.,fine,arg-request_experiment,2.0,2,2
2512,"- Currently there is no experimental evaluation of the claims, which would be valuable given that the setting doesn't immediately apply in the normal batch normalization setting.",fine,arg-request_experiment,2.0,2,2
2513,I would like to see evidence that the main benefit from batch normalization indeed comes from picking a good adaptive learning rate.,fine,arg-request_result,4.0,2,4
2514,"Overall I recommend publishing the paper as it is a well-written and insightful discussion of batch normalization. Be aware that I read the paper and wrote this review on short notice, so I didn't have time to go through all the arguments in detail.",fine,none,9.0,9,9
2515,The paper introduces a generative model for video prediction.,fine,arg-structuring_summary,8.0,8,8
2516,The originality stems from a new training criterion which combines a VAE and a GAN criteria.,fine,arg-structuring_summary,8.0,8,8
2517,"At training time, the GAN and the VAE are trained simultaneously with a shared generator; at test time, prediction conditioned on initial frames is performed by sampling from a latent distribution and generating the next frames via an enhanced conv LST .",fine,arg-structuring_summary,8.0,8,8
2518,Evaluations are performed on two movement video datasets classically used for benchmarking  this task - several quantitative evaluation criteria are considered.,fine,arg-structuring_summary,8.0,8,8
2519,The paper clearly states the objective and provides a nice general description of the method.,fine,none,9.0,9,9
2520,The proposed model extends previous work by adding an adversarial loss to a VAE video prediction model.,fine,none,9.0,8,9
2521,The evaluation compares different variants of this model to two recent VAE baselines.,fine,none,9.0,8,9
2522,A special emphasis is put on the quantitative evaluation: several criteria are introduced for characterizing different properties of the models with a focus on diversity.,fine,none,9.0,8,9
2523,"w.r.t. the baselines, the model behaves well for the “realistic” and “diversity” measures.",fine,none,9.0,9,9
2524,The results are more mitigated for measures of accuracy.,fine,none,9.0,9,9
2525,"As for the qualitative evaluation, the model corrects the blurring effect of the reference SV2P baseline, and produces quite realistic predictions on these datasets.",fine,none,9.0,9,9
2526,The difference with the other reference model (SVG) is less clear.,fine,none,9.0,9,9
2527,"While the general description of the model is clear, details are lacking.",fine,none,9.0,9,9
2528,"It would probably help to position the VAE component more precisely w.r.t. one of the two baselines, by indicating the differences.",fine,none,9.0,2,9
2529,This would also help to explain the difference of performance/ behavior  w.r.t. these models (Fig. 5).,fine,none,9.0,9,9
2530,"It seems that the discriminator takes a whole sequence as input, but some precision on how this done could be added.",fine,none,9.0,9,9
2531,"Similarly, you did not indicate what the deterministic version of your model is.",fine,none,9.0,9,9
2532,The generator model with its warping component makes a strong hypothesis on the nature of the videos: it seems especially well suited for translations or for other simple geometric transformations characteristics of the benchmarking videos .,fine,none,9.0,9,9
2533,Could you comment on the importance of this component? Did you test the model on other types of videos where this hypothesis is less relevant?,fine,arg-request_experiment,2.0,3,2
2534,It seems that the baseline SVG makes use of simpler ConLSTM for example.,fine,none,9.0,9,9
2535,The description of the generator in the appendix is difficult to follow.,fine,none,9.0,9,9
2536,"I missed the point in the following sentence: “For each one-step prediction, the network has the freedom to choose to copy pixels from the previous frame, used transformed versions of the previous frame, or to synthesize pixels from scratch” .",fine,none,9.0,9,9
2537,"Also, it is not clear from the discussion on z, whether sampling is performed once for each video of for each frame.",fine,none,9.0,9,9
2538,"Overall, the paper proposes an extension of VAE based video prediction models and produces an extensive evaluation.",fine,arg-structuring_summary,8.0,8,8
2539,"While the model seems to perform well, the originality and the improvement w.r.t. baselines are somewhat limited.",fine,none,9.0,9,9
2540,This paper presents  a controllable model from a video of a person performing a certain,fine,arg-structuring_summary,8.0,8,8
2541,"activity. It generates novel image sequences of that person, according",fine,arg-structuring_summary,8.0,8,8
2542,"to user-defined control signals, typically marking the displacement of the moving",fine,arg-structuring_summary,8.0,8,8
2543,"body. The generated video can have an arbitrary background, and effectively",fine,arg-structuring_summary,8.0,8,8
2544,capture both the dynamics and appearance of the person.,fine,arg-structuring_summary,8.0,8,8
2545,"It has two networks, Pose2Pose, and Pose2Frame.",fine,arg-structuring_summary,8.0,8,8
2546,The overall pipeline makes sense; and the paper is well written.,fine,none,9.0,9,9
2547,"The main problems come from the experiments, which I would ask for more things.",fine,arg-request_experiment,2.0,1,2
2548,"It has two components, i.e., Pose2Pose and Pose2Frame.",fine,none,9.0,8,9
2549,So how importance of each component to the whole framework? I would ask for the ablation study/additional experiments of using each component.,fine,arg-request_experiment,2.0,2,2
2550,How about combining only Pose2Pose/ Pose2Frame  with pix2pixHD? Whether the performance can get improved?,fine,arg-request_experiment,2.0,2,2
2551,"The paper first provides a generalization bounds for adversarial training, showing that the error bound depends on Lipschitz constant.",fine,arg-structuring_summary,8.0,8,8
2552,This motivates the use of spectral regularization (similar to Miyato et al 2018) in adversarial training.,fine,arg-structuring_summary,8.0,8,8
2553,"Using spectral regularization to improve robustness is not new, but it's interesting to combine spectral regularization and adversarial training.",fine,arg-structuring_summary,8.0,9,8
2554,Experimental results show significant improvement over vanilla adversarial training.,fine,none,9.0,8,9
2555,The paper is nicely written and the experimental results are quite strong and comprehensive. I really like the paper but I have two questions about the results:,fine,none,9.0,6,9
2556,1. The numbers reported in Figure 5 do not match with the performance of adversarial training in previous paper.,fine,none,9.0,9,9
2557,"In PGM L_inf adversarial training/attack (column 3 of Figure 5), the prediction accuracy is roughly 50% under 0.1 infinity norm perturbation.",fine,none,9.0,9,9
2558,"However, previous papers (e.g., ""Obfuscated Gradients Give a False Sense of Security"") reported 55% accuracy under 0.031 infinity norm perturbation.",fine,none,9.0,9,9
2559,I wonder why the numbers are so different.,fine,arg-request_explanation,3.0,3,3
2560,"Maybe it's because of different scales? Previous works usually scale each pixel to [0,1] or [-1,1], maybe the authors use the [0, 255] scale? But 0.1/255 will be much smaller than 0.031.",fine,arg-request_explanation,3.0,3,3
2561,"Another factor might be the model structure. If Alexnet has much lower accuracy, it's probably worthwhile to conduct experiments on the same structure with previous works (Madry et al and Athalye et al) to make the conclusion more clear.",fine,none,9.0,2,9
2562,2. What's the training time of the proposed method compared with vanilla adversarial training?,fine,arg-request_clarification,0.0,3,0
2563,3. The idea of using SN to improve robustness has been introduced in the following paper:,fine,none,9.0,9,9
2564,"""Lipschitz-Margin Training: Scalable Certification of Perturbation Invariance for Deep Neural Networks""",fine,none,9.0,9,9
2565,(but this paper did not combine it with adv training).,fine,none,9.0,9,9
2566,Summary:,fine,arg-structuring_heading,6.0,6,6
2567,This paper is built on the top of DNC model.,fine,arg-structuring_summary,8.0,8,8
2568,"Authors observe a list of issues with the DNC model: issues with deallocation scheme, issues with the blurring of forward and backward addressing, and issues in content-based addressing.",fine,arg-structuring_summary,8.0,8,8
2569,Authors propose changes in the network architecture to solve all these three issues.,fine,arg-structuring_summary,8.0,8,8
2570,"With toy experiments, authors demonstrate the usefulness of the proposed modifications to DNC.",fine,arg-structuring_summary,8.0,8,8
2571,The improvements are also seen in more realistic bAbI tasks.,fine,arg-structuring_summary,8.0,8,8
2572,Major Comments:,fine,arg-structuring_heading,6.0,6,6
2573,The paper is well written and easy to follow.,fine,none,9.0,9,9
2574,The proposed improvements seem to result in very clear improvements.,fine,none,9.0,9,9
2575,The proposed improvements also improve the convergence of the model.,fine,none,9.0,9,9
2576,I do not have any major concerns about the paper.,fine,none,9.0,9,9
2577,I think that contributions of the paper are good enough to accept the paper.,fine,none,9.0,9,9
2578,I also appreciate that the authors have submitted the code to reproduce the results.,fine,none,9.0,9,9
2579,I am curious to know if authors observe similar convergence gains in bAbI tasks as well. Can you please provide the mean learning curve for bAbI task for DNC vs proposed modifications?,fine,arg-request_explanation,3.0,3,3
2580,Summary,fine,arg-structuring_heading,6.0,6,6
2581,This paper proposes a meta-learning framework that leverages unlabeled data by learning the graph-based label propogation in an end-to-end manner.,fine,arg-structuring_summary,8.0,8,8
2582,The proposed approaches are evaluated on two few-shot datasets and achieves the state-of-the-art results.,fine,arg-structuring_summary,8.0,8,8
2583,Pros.,fine,arg-structuring_heading,6.0,6,6
2584,-This paper is well-motivated.,fine,none,9.0,9,9
2585,Studying label propagation in the meta-learning setting is interesting and novel.,fine,none,9.0,9,9
2586,"Intuitively, transductive label propagation should improve supervised learning when the number of labeled instances is low.",fine,none,9.0,9,9
2587,"-The empirical results show improvement over the baselines, which are expected.",fine,none,9.0,9,9
2588,Cons.,fine,arg-structuring_heading,6.0,6,6
2589,-Some technical details  are missing.,fine,none,9.0,9,9
2590,"In Section 3.2.2, the authors only explain how they learn example-based \sigma, but details on how to make graph construction end-to-end trainable are missing.",fine,none,9.0,9,9
2591,Constructing the full weight matrix requires the whole dataset as input and selecting k-nearest neighbor is a non-differentiable operation. Can you give more explanations?,fine,arg-request_explanation,3.0,3,3
2592,-Does episode training help label propagation? How about the results of label propagation without the episode training?,fine,arg-request_explanation,3.0,3,3
2593,[Summary]:,fine,arg-structuring_heading,6.0,6,6
2594,This paper tackles the problem of automatic robot design.,fine,arg-structuring_summary,8.0,8,8
2595,The most popular approach to doing this has been evolutionary methods which work by evolving morphology of agents in a feed-forward manner using a propagation and mutation rules.,fine,arg-structuring_summary,8.0,8,8
2596,This is a non-differentiable process and relies on maintaining a large pool of candidates out of which best ones are chosen with the highest fitness.,fine,arg-structuring_summary,8.0,8,8
2597,"In robot design for a given task using rewards, training each robot design using RL with rewards is an expensive process and not scalable.",fine,arg-structuring_summary,8.0,9,8
2598,This paper uses graph network to train each morphology using RL.,fine,arg-structuring_summary,8.0,8,8
2599,"Thereby, allowing the controller to share parameters and reuse information across generations.",fine,arg-structuring_summary,8.0,8,8
2600,This expedites the score function evaluation improving the time complexity of the evolutionary process.,fine,arg-structuring_summary,8.0,8,8
2601,[Strengths]:,fine,arg-structuring_heading,6.0,6,6
2602,This paper shows some promise when graph network-based controllers augmented with evolutionary algorithms.,fine,none,9.0,9,9
2603,Paper is quite easy to follow.,fine,none,9.0,9,9
2604,[Weaknesses and Clarifications]:,fine,arg-structuring_heading,6.0,6,6
2605,=> Robot design area has been explored extensively in classical work of Sims (1994) etc. using ES.,fine,none,9.0,9,9
2606,"Given that, the novelty of the paper is fairly incremental as it uses NerveNet to evaluate fitness and ES for the main design search.",fine,none,9.0,9,9
2607,=> Environment: The experimental section of the paper can be further improved.,fine,arg-request_experiment,2.0,2,2
2608,"The approach is evaluated only in three cases: fish, walker, cheetah. Can it be applied to more complex morphologies? Humanoid etc. maybe?",fine,arg-request_experiment,2.0,3,2
2609,=> Baselines: The comparison provided in the paper is weak.,fine,none,9.0,9,9
2610,"At first, it compares to random graph search and ES.",fine,arg-structuring_quote,7.0,8,7
2611,But there are better baselines possible.,fine,none,9.0,9,9
2612,One such example would be to have a network for each body part and share parameters across each body part.,fine,none,9.0,9,9
2613,"This network takes some identifying information (ID, shape etc.) about body part as input.",fine,none,9.0,8,9
2614,"As more body parts are added, more such network modules can be added.",fine,none,9.0,9,9
2615,How would the given graph network compare to this?,fine,arg-request_explanation,3.0,3,3
2616,This baseline can be thought of a shared parameter graph with no message passing.,fine,none,9.0,9,9
2617,=> The results shown in Figure-4 (Section-4.2) seems unclear to me.,fine,none,9.0,9,9
2618,"As far as I understand, the model starts with hand-engineered design and then finetuned using evolutionary process.",fine,arg-structuring_summary,8.0,8,8
2619,"However, the original performance of the hand-engineered design is surprisingly bad (see first data point in any plot in Figure-4).",fine,none,9.0,9,9
2620,"Does the controller also start from scratch? If so, why? Also, it is not clear what is the meaning of generations if the graph is fixed, can't it be learned altogether at once?",fine,arg-request_explanation,3.0,3,3
2621,[Recommendation]:,fine,arg-structuring_heading,6.0,6,6
2622,I request the authors to address the comments raised above.,fine,arg-structuring_quote,7.0,9,7
2623,"Overall, this is a reasonable paper but experimental section needs much more attention.",fine,none,9.0,9,9
2624,"In this paper, the authors propose a method for dimensionality reduction of image data.",fine,arg-structuring_summary,8.0,8,8
2625,They provide a structured and deterministic function G that maps a set of parameters C to an image X = G(C).,fine,arg-structuring_summary,8.0,8,8
2626,"The number of parameters C is smaller than the number of free parameters in the image X, so this results in a predictive model that can be used for compression, denoising, inpainting, superresolution and other inverse problems.",fine,arg-structuring_summary,8.0,8,8
2627,"The structure of G is as follows: starting with a small fixed, multichannel white noise image, linearly mix the channels, truncate the negative values to zero and upsample.",fine,arg-structuring_summary,8.0,8,8
2628,This process is repeated multiple times and finally the output is squashed through a sigmoid function for the output to remain in the 0..1 range.,fine,arg-structuring_summary,8.0,8,8
2629,"This approach makes sense and the model is indeed more principled than the one taken by Ulyanov et al. In fact, the DIP of Ulyanov et al. can hardly be considered ""a model"" (or a prior, for that matter), and instead should be considered ""an algorithm"", since it relies on the early stopping of a specific optimization algorithm.",fine,none,9.0,9,9
