,sentence,task,label,encoded,output,target
1278,"In the future, I am quite curious about how these mono-image learned features would fare on more complex downstream tasks (e.g., segmentation, keypoint detection) which necessarily rely less on texture.",fine,arg-request_result,4.0,2,4
1279,Summary,fine,arg-structuring_heading,6.0,6,6
1280,This paper seeks to understand the role of the *number of training examples* in self-supervised learning with images.,fine,arg-structuring_summary,8.0,8,8
1281,The usefulness of the learned features is evaluated with linear probes at each layer for either ImageNet or CiFAR image classification.,fine,arg-structuring_summary,8.0,8,8
1282,"Empirically, they find that a single image along with heavy data augmentation suffices for learning the first 2-3 layers of convolutional weights, while later layers improve with more self-supervised training images.",fine,arg-structuring_summary,8.0,8,8
1283,"The result holds for three state-of-the-art self-supervised methods, tested with two single-image training examples.",fine,arg-structuring_summary,8.0,8,8
1284,"In my view, learning without labels is an important problem, and it is interesting what can be learned from a single image and simple data augmentation strategies.",fine,none,9.0,9,9
1285,Comments / Questions,fine,arg-structuring_heading,6.0,6,6
1286,"It seems to me that for completeness, Table 4 should include the result of training a supervised network on top of random conv1/2 and Scattering network features, because this experiment is actually testing what we want - performance of the features when fine-tuned for a downstream task.",fine,arg-request_result,4.0,9,4
1287,"So for example, even if a linear classifier on top of Scattering features does poorly, if downstream fine-tuning results in the same performance as another pre-training method, then Scattering is a perfectly fine approach for initial features.",fine,arg-request_result,4.0,9,4
1288,Could the authors please either correct this logic or provide the experiments?,fine,none,9.0,3,9
1289,"Further, it seems that the results in Table 4 might be a bit obscured by the size of the downstream task dataset.",fine,none,9.0,9,9
1290,I wonder if the learned features require fewer fully supervised images to obtain the same performance on the downstream task?,fine,arg-request_explanation,3.0,3,3
1291,Can the authors clarify how the neural style transfer experiment is performed?,fine,arg-request_clarification,0.0,2,0
1292,"The method from Gatys et al. requires features from different layers of the feature hierarchy, including deeper layers.",fine,none,9.0,9,9
1293,Are all these features taken directly from the self-supervised network or is it fine-tuned in some way?,fine,arg-request_explanation,3.0,3,3
1294,"While I appreciate the computational burden of testing more images, it does feel that Image A and B are quite cherry-picked in being very visually diverse.",fine,none,9.0,9,9
1295,"Because of this, it seems like a precise answer to what makes a good single training image remains unknown.",fine,none,9.0,9,9
1296,I wonder how feasible it is to find a proxy metric that corresponds to the performance on downstream tasks which is expensive to compute.,fine,arg-request_experiment,2.0,2,2
1297,It might be interesting to try to generate synthetic images (or modify real ones) that are good for this purpose and observe their properties.,fine,arg-request_experiment,2.0,2,2
1298,"I disagree with the claim of practicality in the introduction (page 2, top).",fine,none,9.0,9,9
1299,"While training on one image does reduce the burden of number of images, the computational burden remains the same. And as mentioned above, it doesn’t seem likely that *any* image would work for this method.",fine,none,9.0,9,9
1300,"Finally, more images are needed to learn the deeper layers for the downstream task anyway.",fine,none,9.0,9,9
1301,The paper is well-written and clear.,fine,none,9.0,9,9
1302,The paper design a low variance gradient for distributions associated with continuous or discrete random variables.,fine,arg-structuring_summary,8.0,8,8
1303,The gradient is designed in the way to approximate the  property of reparameterization gradient.,fine,arg-structuring_summary,8.0,8,8
1304,The paper is comprehensive and includes mathematical details.,fine,arg-structuring_summary,8.0,9,8
1305,I have following comments/questions,fine,arg-structuring_heading,6.0,6,6
1306,1. What is the \kappa in “variable-nabla” stands for? What is the gradient w.r.t. \kappa?,fine,none,9.0,3,9
1307,"2. In Eq(8), does the outer expectation w.r.t . y_{-v} be approximated by one sample? If so, it is using the local expectation method.",fine,none,9.0,3,9
1308,How does that differs from Titsias & Lazaro-Gredilla(2015) both mathematically and experimentally?,fine,none,9.0,3,9
1309,"3. Assume y_v is M-way categorical distribution, Eq(8) evaluates f by 2*V*M times which can be computationally expensive.",fine,none,9.0,9,9
1310,What is the computation complexity of GO? How to explain the fast speed shown in the experiments?,fine,none,9.0,3,9
1311,4. A most simple way to reduce the variance of REINFORCE gradient is to take multiple Monte-Carlo samples at the cost of more computation with multiple function f evaluations.,fine,none,9.0,9,9
1312,"Assume GO gradient needs to evaluate f N times, how does the performance compared with the REINFORCE gradient with N Monte-Carlo samples?",fine,none,9.0,3,9
1313,"5. In the discrete VAE experiment, upon brief checking the results in Grathwohl(2017), it shows validation ELBO for MNIST as (114.32,111.12), OMNIGLOT as (122.11,128.20) from which two cases are better than GO.",fine,none,9.0,9,9
1314,Does the hyper parameter setting favor the GO gradient in the reported experiments?,fine,none,9.0,3,9
1315,Error bar may also be needed for comparison.,fine,arg-request_result,4.0,1,4
1316,What about the performance of GO gradient in the 2 stochastic layer setting in Grathwohl(2017)?,fine,none,9.0,3,9
1317,"6. The paper claims GO has less parameters than REBAR/RELAX. But in Figure 9, GO has more severe overfitting. How to explain this contradicts between the model complexity and overfitting?",fine,none,9.0,3,9
1318,The paper proposes a few variations on the RGCN model with adding attention to either within relations or across relations.,fine,arg-structuring_summary,8.0,8,8
1319,Unfortunately the paper falls short in two main areas:,fine,arg-structuring_heading,6.0,6,6
1320,- novelty: the additions proposed are small modifications to existing algorithms and there are other methods of attention on graphs which have been discussed in the paper but not directly compared to (e.g. this method builds heavily on Velickovic et al 2017),fine,none,9.0,9,9
1321,"- impact: the results achieved in the experiments are very small improvements compared to the baseline of RGCN (~ +0.01 in two experiments and ~ -0.04 in another) and often these small variations in results can be compensated with better baselines training (e.g. better hyper-params, ...)",fine,none,9.0,9,9
1322,"However, on a positive note, the paper has been written very well and I really liked the frank discussion on page 8 about results on MUTAG dataset.",fine,none,9.0,9,9
1323,This paper proposes a self-auxiliary-training method that aims to improve the generalization performance of simple supervised learning.,fine,arg-structuring_summary,8.0,8,8
1324,"The basic idea is to train the classification network to predict fine-level auxiliary labels in addition to the ground-truth coarse label, where the auxiliary labels used in training is generated by a generator network.",fine,arg-structuring_summary,8.0,8,8
1325,"During training, the classification network and the generator network are alternatively updated, and the update of the latter aims to maximize the improvement of the former after using the generated auxiliary label for training.",fine,arg-structuring_summary,8.0,8,8
1326,The method requires a class hierarchy in advance to define the binary mask applied to the output layer for auxiliary class prediction.,fine,arg-structuring_summary,8.0,8,8
1327,A KL divergence term is attached to the optimization objective to avoid generating trivial and collapsing auxiliary classes.,fine,arg-structuring_summary,8.0,8,8
1328,Pros:,fine,arg-structuring_heading,6.0,6,6
1329,1) The main idea is simple and easy to understand.,fine,none,9.0,9,9
1330,"2) It discusses the class collapsing problem in generating pseudo (auxiliary) labels and provides a reasonable solution, i.e., using KL divergence as regularization.",fine,none,9.0,9,9
1331,3) Uses several visualizations to show experimental results.,fine,none,9.0,9,9
1332,Cons:,fine,arg-structuring_heading,6.0,6,6
1333,"1) The problem it aims to solve is neither multi-task learning nor meta-learning: it tries to solve a supervised classification problem defined on principle classes, with the help of simultaneously predicting/generating auxiliary class labels.",fine,none,9.0,9,9
1334,"Although the concept of ""task"" is not explicitly defined in this paper, the authors seem to associate each task with a specific class.",fine,none,9.0,9,9
1335,"This is not correct: in meta-learning, each task is a subset of classes drawn from a ground set of classes, and different tasks are independently sampled.",fine,none,9.0,9,9
1336,"In addition, the classification models for different tasks are independent, though their training might be related by a meta-learner.",fine,none,9.0,9,9
1337,"Hence, the claims in multiple places of this paper and the names for the two networks are misleading.",fine,none,9.0,9,9
1338,"2) At the end of Page 4, the authors show that the update of the generator only depends on the improvement of the classifier after using the auxiliary label for training.",fine,none,9.0,9,9
1339,"In fact, the optimal auxiliary labels minimizing the objective is the ground truth label for principle classes.",fine,none,9.0,9,9
1340,This results in the class collapsing problem observed by the authors.,fine,none,9.0,8,9
1341,"The KL divergence regularization introduces extra randomness to the auxiliary labels and thus mitigates the problem, but it hardly provides any useful information except randomness.",fine,none,9.0,9,9
1342,"In other words, the auxiliary labels for a specific principle class are very possible to be multiple noisy copies of the principal label with random perturbations.",fine,none,9.0,9,9
1343,So it is not convincing to me that the auxiliary labels generated by the generator can be really helpful.,fine,none,9.0,9,9
1344,"My conjecture is that the observed improvements are mainly due to the softness of the auxiliary labels, which has been proved by model compression/knowledge distillation and recent ""born-again neural networks"".",fine,none,9.0,9,9
1345,"To verify this, the authors might need to compare the results with those methods (which use the generated soft probability of ground truth classes for training), and the ""random-noisy copies of soft principle label"" mentioned above.",fine,arg-request_result,4.0,2,4
1346,"3) The experiments lack comparisons to several important baselines from self-supervised learning community, and methods using soft labels for training (as mentioned in 2) above).",fine,none,9.0,9,9
1347,"A successful idea of self-supervised learning is to use the output feature map of the trained classification network to generate auxiliary training signals, since it provides extra information about the learned distance beyond the ground-truth labels.",fine,none,9.0,8,9
1348,"The authors might want to compare to ""Mathilde Caron, Piotr Bojanowski, Armand Joulin, and Matthijs Douze.",fine,arg-request_result,4.0,2,4
1349,"Deep Clustering for Unsupervised Learning of Visual Features. ECCV 2018."" and ""Carl Doersch and Andrew Zisserman. Multi-task self-supervised visual learning. ICCV 2017."" Moreover, since the method is not a meta-learning approach for few-shot learning, it is not fair and also not appropriate to compare with Prototypical Network.",fine,none,9.0,9,9
1350,"4) Although the paper claims that the ground truth fine labels are not required, it requires a class hierarchy, which in the experiments are provided by the dataset and defined between true coarse and fine classes.",fine,none,9.0,9,9
1351,"In practice, such hierarchy might be much harder to achieve than the primary (coarse) labels, and might be as costly to obtain as the true fine-class labels.",fine,none,9.0,9,9
1352,This weakens the feasibility of the proposed method.,fine,none,9.0,9,9
1353,"5) The experiments only test the proposed method on CIFAR100 and CIFAR10, which has at most 100 fine classes.",fine,none,9.0,9,9
1354,"It is necessary to test it on datasets with much more fine classes and much-complicated hierarchy, e.g., ImageNet, MS COCO or their subsets, which have ideal class hierarchy structures.",fine,none,9.0,9,9
1355,Minor comments:,fine,arg-structuring_heading,6.0,6,6
1356,Some important equations in the paper should be numbered.,fine,arg-request_typo,5.0,1,5
1357,This paper proposes an approach for automatic robot design based on Neural graph evolution.,fine,arg-structuring_summary,8.0,8,8
1358,"The overall approach has a flavor of genetical algorithms, as it also performs evolutionary operations on the graph, but it also allows for a better mechanism for policy sharing across the different topologies, which is nice.",fine,arg-structuring_summary,8.0,8,8
1359,"My main concern about the paper is that, currently, the experiments do not include any strong baseline (the ES currently is not a strong baseline, see comments below).",fine,none,9.0,9,9
1360,"The experiments currently demonstrate that optimizing both controller and hardware is better than optimizing just the controller, which is not surprising and is a phenomenon which has been previously studied in the literature.",fine,none,9.0,9,9
1361,What instead is missing is an answer to the question: Is it worth using a neural graph? what are the advantages and disadvantages compared to previous approaches?,fine,none,9.0,3,9
1362,I would like to see additional experiments to answer this questions.,fine,arg-request_experiment,2.0,2,2
1363,"In particular, I believe that any algorithms you compare against, you should optimize both G and theta, since optimizing purely the hardware is unfair.",fine,none,9.0,9,9
1364,"You should use an existing ES implementation (e.g., from some well-known package) instead of a naive implementation, and as additional baseline also CMA-ES.",fine,arg-request_edit,1.0,1,1
1365,If you can also compare against one or two algorithms of your choice from the recent literature it would also give more value to the comparison.,fine,arg-request_experiment,2.0,2,2
1366,Detailed comments:,fine,arg-structuring_heading,6.0,6,6
1367,"- in the abstract you say that ""NGE is the first algorithm that can automatically discover complex robotic graph structures"".",fine,arg-structuring_quote,7.0,9,7
1368,This statement is ambiguous and potentially unsupported by evidence. how do you define complex? that can or that did discover?,fine,arg-request_explanation,3.0,3,3
1369,- in the introduction you mention that automatic robot design had limited success.,fine,arg-structuring_quote,7.0,9,7
1370,"This is rather subject, and I would tend to disagree.",fine,none,9.0,9,9
1371,"Moreover, the same limitations that apply to other algorithms to make them successful, in my opinion, apply to your proposed algorithm (e.g., difficulty to move from simulated to real-world).",fine,none,9.0,9,9
1372,- The digression at the bottom of the first page about neural architecture search seem out of context and interrupts the flow of the introduction.,fine,none,9.0,9,9
1373,"What is the point that you are trying to make? Also, note that some of the algorithms that you are citing there have indeed applied beyond architecture search, eg. Bayesian optimization is used for gait optimization in robotics, and Genetic algorithms have been used for automatic robot design.",fine,arg-request_explanation,3.0,3,3
1374,- The stated contributions number 3 and 5 are not truly contributions.,fine,none,9.0,9,9
1375,#3 is so generic that a large part of the previous literature on the topic fall under this category -- not new.,fine,none,9.0,9,9
1376,"#5 is weak, and tell us more about the limitations of random search and naive ES than necessarily a merit of your approach.",fine,none,9.0,9,9
1377,"- Sec 2.2: ""(GNNs) are very effective"" effective at what? what is the metric that you consider?",fine,arg-request_explanation,3.0,3,3
1378,"- Sec 3 ""(PS), where weights are reused"" can you already go into more details or refer to later sections?",fine,arg-request_explanation,3.0,1,3
1379,"- First line page 4 you mention AF, without introducing the acronym ever before.",fine,none,9.0,9,9
1380,- Sec 3.1: the statements about MB and MF algorithms are inaccurate.,fine,none,9.0,9,9
1381,Model-based RL algorithms can work in real-time (e.g. http://proceedings.mlr.press/v78/drews17a/drews17a.pdf) and have been shown to have same asymptotic performance of MB controllers for simple robot control (e.g. https://arxiv.org/abs/1805.12114),fine,none,9.0,9,9
1382,"- ""to speed up and trade off between evaluating fitness and evolving new species"" Unclear sentence. speed up what",fine,arg-request_clarification,0.0,5,0
1383,? why is this a trade-off?,fine,none,9.0,3,9
1384,- Sec 3.4 can you recap all the parameters after eq.11? going through Sec 3.2 and 2.2 to find them is quite annoying.,fine,arg-request_clarification,0.0,9,0
1385,- Sec 4.1:,fine,none,9.0,6,9
1386,would argue that computational cost is rarely a concern among evolutionary algorithms.,fine,none,9.0,9,9
1387,"The cost of evaluating the function is typically more pressing, and as a result it is important to have algorithms that can converge within a small number of iterations/generations.",fine,none,9.0,9,9
1388,"- Providing the same computational budget seem rather arbitrary at the moment, and it heavily depends from implementation. How many evaluations do you perform for each method? why not having the same budget of experiments?",fine,arg-request_explanation,3.0,3,3
1389,Summary:,fine,arg-structuring_heading,6.0,6,6
1390,"The manuscript proposes a modification of generators in GANs which improves performance under two popular metrics for multiple architectures, loss, benchmarks, regularizers, and hyperparameter settings.",fine,none,9.0,8,9
1391,"Using the conditional batch normalization mechanism, the input noise vector is allowed to modulate layers of the generator.",fine,none,9.0,8,9
1392,"As this modulation only depends on the noise vector, this technique does not require additional annotations.",fine,none,9.0,9,9
1393,"In addition to the extensive experimentation on different settings showing performance improvements, the authors also present an ablation study, that shows the impact of the method when applied to different layers.",fine,none,9.0,8,9
1394,Strengths:,fine,arg-structuring_heading,6.0,6,6
1395,- The idea is simple.,fine,none,9.0,9,9
1396,The experimentation is extensive and results are convincing in that they show a clear improvement in performance using the method in a large majority of settings.,fine,none,9.0,9,9
1397,- I also like the ablation study showing the impact of the method applied at different layers.,fine,none,9.0,9,9
1398,Requests for clarification/additional information:,fine,arg-structuring_heading,6.0,6,6
1399,"- I might have missed that, but are the authors offering an interpretation of their observation that the performance of the self-modulation model performs worse in the combination of spectral normalization and the SNDC architecture?",fine,arg-request_experiment,2.0,3,2
1400,- The ablation study shows that the impact is highest when modulation is applied to the last layer (if only one layer is modulated).,fine,none,9.0,9,9
1401,It seems modulation on layer 4 comes in as a close second.,fine,none,9.0,9,9
1402,I am curious about why that might be.,fine,arg-request_explanation,3.0,3,3
1403,- I would like to see some more interpretation on why this method works.,fine,arg-request_clarification,0.0,2,0
1404,- Did the authors inspect generated samples of the baseline and the proposed method? Is there a notable qualitative difference?,fine,arg-request_experiment,2.0,3,2
1405,"Overall, the idea is simple, the explanation is clear and experimentation is extensive. I would like to see more commentary on why this method might have long-term impact (or not).",fine,arg-request_clarification,0.0,2,0
1406,"This paper is an empirical contribution regarding SGD arguing that it presents two different behaviors which the authors name a noise dominated regimen, and a curvature dominated regime.",fine,arg-structuring_summary,8.0,8,8
1407,They observe that the behaviors seem to arise in different batch sizes,fine,arg-structuring_summary,8.0,8,8
1408,The authors derive empirical conclusions and perform experiments in different settings.,fine,arg-structuring_summary,8.0,8,8
1409,The paper is well-written and the experimental setup seems to be carefully carried out.,fine,none,9.0,9,9
1410,"I find the observations interesting, but the contribution is empirical and not entirely new. It would be nice if there were some theoretical results to back up the observations.",fine,none,9.0,9,9
1411,"This paper aims to estimate time-delayed, nonlinear causal influences from time series under the causal sufficiency assumption.",fine,arg-structuring_summary,8.0,8,8
1412,It is easy to follow and contains a lot of empirical results.,fine,none,9.0,9,9
1413,"Thanks for the results, but I have several questions.",fine,arg-structuring_heading,6.0,9,6
1414,"First, In Theorem 2, which seems to be a main result of the paper, the authors were concerned with the condition when W_{ji} >0, but there is not conclusion if W_{ji} =0.",fine,none,9.0,9,9
1415,"In order to correctly estimate causal relations from data, both cases must be considered.",fine,none,9.0,9,9
1416,"Second, the conclusion of Theorem 2 seems to be flawed.",fine,none,9.0,9,9
1417,Let me try to make it clear with the following example.,fine,arg-structuring_heading,6.0,6,6
1418,"Suppose x^1_{t-2} directly causes x^2_{t-1} and that x^2_{t-1} directly causes x^3_{t}, without a direct influence from x^1_{t-2}  to x^3_{t}. Then when minimizing (2), we have the following results step by step:",fine,none,9.0,9,9
1419,"1) The noise standard deviation in x^2_{t-1}, denoted by \eta_2, may be non-zero.",fine,none,9.0,9,9
1420,"This is because we minimize a tradeoff of the prediction error (the first term in (2)) and a function of the reciprocal of the noise standard deviation \eta_2 (the second term in (2)), not only the prediction error.",fine,none,9.0,9,9
1421,"2) If \eta_2 is non-zero, then x^1_{t-2} will be useful for the purpose of predicting x^3_{t}. (Note that if \eta_2 is zero, then x^1_{t-2} is not useful for predicting x^3_{t).) From the d-separation perspective, this is because x^1_{t-2} and x^3_{t} are not d-separated by x^2_{t-1} + \eta_2 \cdot \epsilon_2, although they are d-separated by x^2_{t-1}. Then the causal Markov condition tells use that x^1_{t-2} and x^3_{t} are not independent conditional on x^2_{t-1} + \eta_2 \cdot \epsilon_2, which means that x^1_{t-2} is useful for predicting x^3_{t}.",fine,none,9.0,9,9
1422,"3) Given that x^1_{t-2} is useful for predicting x^3_{t}, when (2) is minimized, \eta_1 will not go to infinity, resulting in a non-zero W_{13), which *mistakenly* tells us that X^{1}_{t-1} directly structurally causes x^{(3)}_t.",fine,none,9.0,9,9
1423,This illustrates that the conclusion of Theorem 2 may be wrong.,fine,none,9.0,9,9
1424,I believe this is because the proof of Theorem 2 is flawed in lines 5-6 on Page 16.,fine,none,9.0,9,9
1425,It does not seem sensible to drop X^{j}_{t-1} + \eta_X \cdot \epsilon_X and attain a smaller value of the cost function at the same time.,fine,none,9.0,9,9
1426,"Please carefully check it, especially the argument given in lines 10-13.",fine,none,9.0,9,9
1427,"Third, it is rather surprising that the authors didn't mention anything about the traditional causal discovery methods based on conditional independence relations in the data, known as constraint-based methods, such as the PC algorithm (Spirtes et al., 1993), IC algorithm (Pearl, 2000), and FCI (Spirtes et al., 1993).",fine,none,9.0,9,9
1428,Such methods are directly applicable to time-delayed causal relations by further considering the constraint that effects temporally follow the causes.,fine,none,9.0,9,9
1429,"Fourth, please make it clear that the proposed method aims to estimate ""causality-in-mean"" because of the formulation in terms of regression.",fine,none,9.0,9,9
1430,"For instance, if x^j_{t-1} influences only the variance of x^i_{t}, but not its mean, then the proposed method may not detect such a causal influence, although the constraint-based methods can.",fine,none,9.0,9,9
1431,Any response would be highly appreciated.,fine,none,9.0,9,9
1432,The recent work of Schott et al (which the authors compare results to) proposed the use of Bayes rule inversion as a more robust mechanism for classification under different types of adversarial attacks.,fine,arg-structuring_summary,8.0,8,8
1433,The probabilities are approximated with variational autoencoders.,fine,arg-structuring_summary,8.0,8,8
1434,"During training the inference network is used, but during testing optimization based inference is carried out to compute loglikelihoods.",fine,arg-structuring_summary,8.0,8,8
1435,"This paper focuses on the second part, with a different model.",fine,arg-structuring_summary,8.0,8,8
1436,"Specifically, it proposes a specific Boltzmann machine to be used as a first layer of neural networks for MNIST classification.",fine,arg-structuring_summary,8.0,8,8
