,sentence,task,label,encoded,output,target
3870,"However, this paper rather than proposing solution address the meta-learning problem, albeit the title “meta domain adaptation”, only brings few-shot learning to domain adaptation.",fine,none,9.0,9,9
3871,Here’s why:,fine,arg-structuring_heading,6.0,6,6
3872,"In order for a meta-learning model to be called “meta domain adaptation,” the type of adaptation cannot be seen during training, and the goal is to test on adaptation that the model has not seen before.",fine,none,9.0,9,9
3873,"Indeed, each task in meta domain adaptation should be seen as a pair of source task and target task.",fine,none,9.0,9,9
3874,"The problem with the current model is that during training, it is trained to target at one specific type of test domain--the generator network G aims to generated images that align with the unsupervised  test domain X_test.",fine,none,9.0,9,9
3875,"Thus, the trained model will also only be able to handle one test domain, not much different than regular meta-learning models.",fine,none,9.0,9,9
3876,"In short, the meta-learning part stays in the regular few-shot learning module (which is implemented as a prototypical network), and has nothing related to domain adaptation.",fine,none,9.0,9,9
3877,"Therefore, the paper cannot be qualified for ``meta domain adaptation’’ and has very limited novelty in terms of its contribution to meta-learning; however, the combination of domain adaptation and few-shot learning is fair.",fine,none,9.0,9,9
3878,"For the rest of my review, I will treat the paper as “few-shot learning with domain adaptation” for more appropriate analysis.",fine,arg-structuring_quote,7.0,1,7
3879,"For the experiments, there seems to have a great win of the proposed algorithm against the baselines.",fine,none,9.0,9,9
3880,"However, I think since this is few-shot learning with domain adaptation, there is no domain adaptation baselines being mentioned in comparison.",fine,none,9.0,9,9
3881,"Specifically, what if the few-shot learning component is removed, and the network is trained with standard domain adaptation.",fine,arg-request_explanation,3.0,3,3
3882,Then use the same network to extract the features and then using the nearest neighbor to retrieve the classes.,fine,none,9.0,8,9
3883,"Also it seems that the regular batch normalization could be very sensitive to domain shifts, and it would be good if the authors can test other normalization schemes such as layer/group normalization as baselines.",fine,arg-request_experiment,2.0,2,2
3884,Another concern is that the evaluation of domain adaptation does not have much varieties.,fine,none,9.0,9,9
3885,"Only two domains shifts are evaluated in the paper, specifically Omniglot + BSD500 and Office-Home.",fine,arg-structuring_quote,7.0,9,7
3886,"BSD 500 only contains 500 images, and it would be good if more diverse set of images are considered.",fine,arg-request_experiment,2.0,2,2
3887,Other domain transfer settings such as synthetic rendered vs. real (e.g. visDA challenge) could have been considered.,fine,arg-request_experiment,2.0,2,2
3888,"In conclusion, the paper presents a interesting combination of ProtoNet + Adversarial DA + Cycle consistency.",fine,arg-structuring_summary,8.0,8,8
3889,"However, unlike as advertised, the paper does not address the domain shift issue in meta-learning, and the experiments lack thorough evaluation as the paper considers itself as a meta-learning paper and only compares to other meta-learning approaches without much comparison to domain adaptation papers.",fine,none,9.0,9,9
3890,"Therefore, I recommend reject.",fine,none,9.0,9,9
3891,---,fine,arg-structuring_heading,6.0,6,6
3892,"Note: after reading the comments updated by authors, I remain my opinions: even though exact meta-testing data is unseen during training, the domain is seen during training, and therefore it cannot be qualified for being ""meta domain adaptation"".",fine,none,9.0,9,9
3893,===,fine,arg-structuring_heading,6.0,6,6
3894,After rebuttal:,fine,arg-structuring_heading,6.0,6,6
3895,I would like to thank the authors for the response and updating the draft.,fine,none,9.0,9,9
3896,They have addressed 1) the title issue and 2) adding domain adaptation baselines.,fine,arg-structuring_summary,8.0,8,8
3897,"Considering these improvements, I would like to raise the score to 5, since the setting of combining few-shot learning and domain adaptation is interesting and the proposed model outperforms the baselines.",fine,none,9.0,9,9
3898,"However, my criticisms remain that the paper is a simple combination of cycle GAN and prototypical networks, and lacks new insights/novelty.",fine,none,9.0,9,9
3899,"The experiments use fairly small datasets, where the performance can be largely influenced by how good the feature extractor backbone is (e.g. training on more data and using deeper architecture would warrant better performance, and thus may change the conclusion).",fine,none,9.0,9,9
3900,The idea of having a separate class for out-distribution is a very interesting idea but unfortunately previously explored.,fine,none,9.0,9,9
3901,"In fact, in machine learning and NLP there is the OOV class which sometimes people in computer vision also use.",fine,none,9.0,9,9
3902,Some of the claims in the paper can be further substantiated or explored.,fine,none,9.0,9,9
3903,For example in abstract there is a simple claim that is presented too strong: We also demonstrate that training such an augmented CNN with representative out-distribution natural datasets and some interpolated samples allows it to better handle a wide range of unseen out-distribution samples and black-box adversarial examples without training it on any adversaries.,fine,none,9.0,9,9
3904,This claim is bigger than just CNNs and needs to be studied in a theoretical framework not an empirical one.,fine,none,9.0,9,9
3905,"Also, one simple way to stop these adversarial cases would be to explore using Sigmoid as opposed to softmax.",fine,none,9.0,9,9
3906,In general it is very unlikely that you will be able to choose every variation of out-distribution cases.,fine,none,9.0,9,9
3907,Much easier if you just try to solve the problem using a set of n Sigmoids (n total number of classes) and consider each output a probability distribution.,fine,none,9.0,9,9
3908,"However, the studies in this paper are still valuable and I strongly recommend continuing on the same direction.",fine,none,9.0,9,9
3909,# Summary,fine,arg-structuring_summary,8.0,6,8
3910,"This paper proposes a new kind of spherical convolution for use in spherical CNNs, and evaluates it on rigid and non-rigid 3D shape recognition and retrieval problems.",fine,arg-structuring_summary,8.0,8,8
3911,Previous work has either used general anisotropic convolution or azimuthally isotropic convolution.,fine,arg-structuring_summary,8.0,8,8
3912,"The former produces feature maps on SO(3), which is deemed undesirable because processing 3-dimensional feature maps is costly.",fine,arg-structuring_summary,8.0,8,8
3913,"The latter produces feature maps on the sphere, but requires that filters be circularly symmetric / azimuthally isotropic, which limits modeling capacity.",fine,arg-structuring_summary,8.0,8,8
3914,This paper proposes an anisotropic spherical convolution that produces 2D spherical feature maps.,fine,arg-structuring_summary,8.0,8,8
3915,"The paper also introduces an efficient way of processing geodesic / icosahedral spherical grids, avoiding complicated spectral algorithms.",fine,arg-structuring_summary,8.0,8,8
3916,# Strengths,fine,none,9.0,6,9
3917,The paper has several strong points.,fine,none,9.0,9,9
3918,"It is well written, clearly structured, and the mathematics is clear and precise while avoiding unnecessary complexity.",fine,none,9.0,9,9
3919,"Much of the relevant related work is discussed, and this is done in a balanced way.",fine,none,9.0,9,9
3920,"Although it is not directly measured, it does seem highly likely that the alt-az convolution is more computationally efficient than SO(3) convolution, and more expressive than isotropic S2 convolution.",fine,none,9.0,9,9
3921,"The most important contribution in my opinion is the efficient data structure presented in section 4, which allows the spherical convolution to be computed efficiently on GPUs for a grid that is much more homogeneous than the lat/lon grids used in previous works (which have very high resolution near the poles, and low resolution at the equator).",fine,none,9.0,9,9
3922,"The idea of carving up the icosahedral grid in just the right way, so that the spherical convolution can be computed as a planar convolution with funny boundary conditions, is very clever, elegant, and practical.",fine,none,9.0,9,9
3923,# Weaknesses,fine,arg-structuring_heading,6.0,6,6
3924,There is however a misunderstanding about the properties of the alt-az convolution that must be cleared up before this paper can be published.,fine,none,9.0,9,9
3925,"To start with, the set of rotations R(phi, nu, 0) called the alt-az group in this paper is not a group in the mathematical sense.",fine,none,9.0,9,9
3926,"This easy to see, because a composition of rotations of the form Rz(phi) Ry(nu) is not generally of that form.",fine,none,9.0,9,9
3927,"For instance we can multiply Rz(phi) Ry(nu) by the element Rz(omega)Ry(0) = Rz(omega), which gives the element Rz(phi) Ry(nu) Rz(omega).",fine,none,9.0,9,9
3928,"As noted in the paper, this is a general element of SO(3) (and hence not in the set of alt-az rotations)",fine,none,9.0,9,9
3929,.,fine,none,9.0,9,9
3930,So the closure axiom of a group is violated.,fine,none,9.0,9,9
3931,"This matters, because the notion of equivariance really only makes sense for a group.",fine,none,9.0,9,9
3932,"If a layer l satisfies l R = R l  (for R a alt-az rotation), then it automatically satisfies l RR' = RR' l, which means l is equivariant to the whole group generated by the set of alt-az rotations.",fine,none,9.0,9,9
3933,"As we saw before, this is the whole rotation group.",fine,none,9.0,9,9
3934,"This would mean that the layer is actually SO(3)-equivariant, but it has been proven [1], that any rotation equivariant layer between scalar spherical feature maps can be expressed as an azimuthally isotropic convolution.",fine,none,9.0,9,9
3935,"Since the alt-az convolution is not isotropic and maps between scalars on S2, it cannot be equivariant.",fine,none,9.0,9,9
3936,"This also becomes apparent in the experiments section, where rotational data augmentation is found to be necessary.",fine,none,9.0,9,9
3937,"The paper does not contain an attempted proof of equivariance, and if one tries to give one, the impossibility of doing so will become apparent.",fine,none,9.0,9,9
3938,I note that the alt-az convolution *is* equivariant to rotations in the subgroup SO(2) of rotations around the Z-axis.,fine,none,9.0,9,9
3939,Another somewhat jarring fact about the alt-az convolution is that it is not well defined on the south pole.,fine,none,9.0,9,9
3940,"The south pole can be represented by any pair of coordinates of the form phi in [0, 2pi], nu = +/- pi.",fine,none,9.0,9,9
3941,"But it is easy to see that eq. 10 will give different results for each of these coordinates, because they correspond to different rotations of the filter about the Z-axis.",fine,none,9.0,9,9
3942,"This is ultimately due to the fact that the set of alt-az rotations is not the same as the set of points on the sphere, topologically speaking.",fine,none,9.0,9,9
3943,The set of points on the sphere can only be viewed as the quotient SO(3)/S(2).,fine,none,9.0,9,9
3944,"The paragraph motivating the alt-az convolution on page 4 is not very clear, and some claims are questionable.",fine,none,9.0,9,9
3945,"I agree that local SO(2) invariance is too limiting. But it is not true that rotating filters is not effective in planar/volumetric CNNs, as shown by many recent papers on equivariant networks.",fine,none,9.0,9,9
3946,"I would suggest rewriting this paragraph to make it clearer and less speculative, and acknowledge that although rotating filters might increase computational complexity, it has often been shown very effective.",fine,arg-request_edit,1.0,1,1
3947,# Other comments,fine,arg-structuring_summary,8.0,6,8
3948,The experiments show that the method is quite effective.,fine,none,9.0,9,9
3949,"For instance, the SHREC17 results are on par with Cohen et al. and Esteves et al., presumably at a significantly reduced computational cost.",fine,none,9.0,9,9
3950,That they do not substantially outperform these and other methods,fine,none,9.0,9,9
3951,"is likely due to the input representation, which is lossy, leading to a maximal performance shared by all three methods.",fine,none,9.0,9,9
3952,"An application to omnidirectional vision might more clearly show the strength of the method, but this would be a lot of work so I do not expect the authors to do that for this paper.",fine,none,9.0,9,9
3953,"It would be nice to see a more direct comparison between the three definitions of spherical convolution (general SO3, isotropic S2, and anisotropic S2).",fine,none,9.0,2,9
3954,"Right now, the numbers reported in Cohen et al. and Esteves et al. are copied over, but there are probably many differences between the precise setup and architectures used in these papers.",fine,none,9.0,9,9
3955,"It would be interesting to see what happens if one uses the same architecture on a number of problems, changing only the convolution in each case.",fine,none,9.0,2,9
3956,"Initially, I was a bit puzzled about why SO(3) augmentation seems to reduce accuracy in table 1.",fine,none,9.0,9,9
3957,I think this is because SO(3) augmentation actually makes the classification problem harder if the input is initially aligned.,fine,none,9.0,9,9
3958,Some more explanation / discussion would be good.,fine,arg-request_explanation,3.0,2,3
3959,It would be nice to explain the spherical parameterization in more detail. Is this operation itself rotation equivariant?,fine,arg-request_explanation,3.0,3,3
3960,Typos & minor issues,fine,arg-structuring_heading,6.0,6,6
3961,"- Abstract: ""to extract non-trivial features"".",fine,arg-request_edit,1.0,1,1
3962,The word non-trivial really doesn't add anything here.,fine,arg-request_edit,1.0,9,1
3963,"Similarly ""offers multi-level feature extraction capabilities"" is almost meaningless since all DL methods can be said to do so.",fine,arg-request_edit,1.0,9,1
3964,"- Below eq. 5, D_R^{-1} should equal D_R(-omega, -nu, -phi).",fine,arg-request_edit,1.0,1,1
3965,The order is reversed when inverting.,fine,arg-request_edit,1.0,9,1
3966,"- ""Different notations of convolutions"" -> notions",fine,arg-request_typo,5.0,5,5
3967,"- ""For spherical functions there is no consistent and well defined convolution operators."" As discussed above, the issue is quite a bit more subtle. There are exactly two well-defined convolution operators, but they have some characteristics deemed undesirable by the authors.",fine,arg-request_edit,1.0,9,1
3968,"- ""rationally symmetric"" -> rotationally",fine,arg-request_typo,5.0,5,5
3969,"- ""exact hierarchical spherical patterns"" -> extract",fine,arg-request_typo,5.0,5,5
3970,- It seems quite likely that the unpacking of the icosahedral/hexagonal grid as done in this paper has been studied before in other fields.,fine,arg-request_edit,1.0,9,1
3971,"References would be in order. Similarly, hexagonal convolution has a history in DL and outside.",fine,arg-request_edit,1.0,9,1
3972,"- Bottom of page 7, capitalize ""for"".",fine,arg-request_typo,5.0,5,5
3973,"- ""principle curvatures"" -> principal.",fine,arg-request_typo,5.0,5,5
3974,"- ""deferent augmentation modes"" -> different",fine,arg-request_typo,5.0,5,5
3975,"- ""inspite"" -> in spite",fine,arg-request_typo,5.0,5,5
3976,"- ""reprort"" -> report",fine,arg-request_typo,5.0,5,5
3977,"- ""utlize"" -> utilize",fine,arg-request_typo,5.0,5,5
3978,"- ""computer the convolution"" -> compute",fine,arg-request_typo,5.0,5,5
3979,# Conclusion,fine,arg-structuring_heading,6.0,6,6
3980,"Although the alt-az convolution lacks the mathematical elegance of the general anisotropic and azimuthally isotropic spherical convolutions, it still seems like a practically useful operation for some kinds of data, particularly when implemented using the homogeneous icosahedral/hexagonal grid and fast algorithm presented in this paper.",fine,arg-structuring_summary,8.0,9,8
3981,"Hence, I would wholeheartedly recommend acceptance of this paper if the authors correct the factual errors (e.g. the claim of SO(3)-equivariance) and provide a clear discussion of the issues.",fine,none,9.0,9,9
3982,For now I will give an intermediate rating to the paper.,fine,none,9.0,9,9
3983,"[1] Kondor, Trivedi, ""On the Generalization of Equivariance and Convolution in Neural Networks to the Action of Compact Groups""",fine,none,9.0,9,9
3984,Summary: This paper is about models for solving basic math problems.,fine,arg-structuring_summary,8.0,8,8
3985,The main contribution is a synthetically generated dataset that includes a variety of types and difficulties of math problems; it is both larger and more varied than previous datasets of this type.,fine,arg-structuring_summary,8.0,8,8
3986,"The dataset is then used to evaluate a number of recurrent models (LSTM, LSTM+attention, transformer); these are very powerful models for general sequence-sequence tasks, but they are not explicitly tailored to math problems.",fine,arg-structuring_summary,8.0,8,8
3987,"The results are then analyzed and insights are derived explaining where neural models seemingly cope well with math tasks, and where they fall down.",fine,arg-structuring_summary,8.0,8,8
3988,Strengths: I am happy to see the proposal of a very large dataset with a lot of different axes for measuring and examining the performance of models.,fine,none,9.0,9,9
3989,"There are challenging desiderata involved in building the training+tests sets, and the authors have an interesting and involved methodology to accomplish these.",fine,none,9.0,9,9
3990,"The paper is very clearly written. I'm not aware of a comparable work, so the novelty here seems good.",fine,none,9.0,9,9
3991,"Weaknesses: The dataset created here is entirely synthetic, and the paper only includes one single small real-world case; it seems like it would be easy to generate a larger and more varied real world dataset as well (possibly from the large literature of extant solved problems in workbooks).",fine,none,9.0,9,9
3992,It would have been useful to compare the general models here with some specific math problem-focused ones as well.,fine,arg-request_experiment,2.0,2,2
3993,Some details weren't clear to me.,fine,none,9.0,9,9
3994,More in the comments below.,fine,arg-structuring_heading,6.0,6,6
3995,"Verdict: I thought this was generally an interesting paper that has some very nice benefits, but also has some weaknesses that could be resolved. I view it as borderline, but I'm willing to change my mind based on the discussion.",fine,arg-structuring_summary,8.0,9,8
3996,Comments:,fine,arg-structuring_heading,6.0,6,6
3997,- One area that could stand to be improved is prior work.,fine,arg-request_experiment,2.0,2,2
3998,I'd like to see more of a discussion of *prior data sets* rather than papers proposing models for problems.,fine,arg-request_experiment,2.0,2,2
3999,"Since this is the core contribution, this should also be the main comparison.",fine,none,9.0,9,9
4000,"For example, EMLNP 2017 paper ""Deep Neural Solver for Math Word Problems"" mentions a size 60K problem dataset.",fine,none,9.0,9,9
4001,A more extensive discussion will help convince the readers that the proposed dataset is indeed the largest and most diverse.,fine,none,9.0,2,9
4002,"- The authors note that previous datasets are often specific to one type of problem (i.e., single variable equation solving). Why not then combine multiple types of extant problem sets?",fine,arg-request_explanation,3.0,3,3
4003,- The authors divide dataset construction into crowdsourcing and synthetic.,fine,arg-structuring_quote,7.0,9,7
4004,"This seems incomplete to me: there are tens of thousands (probably more) of exercises and problems available in workbooks for elementary, middle, and high school students.",fine,none,9.0,9,9
4005,"These are solved, and only require very limited validation.",fine,none,9.0,9,9
4006,They are also categorized by difficulty and area.,fine,none,9.0,9,9
4007,"Presumably the cost here would be to physically scan some of these workbooks, but this seems like a very limited investment. Why not build datasets based on workbooks, problem solving books, etc?",fine,arg-request_explanation,3.0,3,3
4008,- How do are the difficulty levels synthetically determined?,fine,arg-request_explanation,3.0,3,3
4009,"- When generating the questions, the authors ""first sample the answer"". What's the distribution you use on the answer? This seems like it dramatically affects the resulting questions, so I'm curious how it's selected.",fine,arg-request_explanation,3.0,3,3
4010,- The general methodology of generating questions and ensuring that no question is too rare or too frequent and the test set is sufficiently different---these are important questions and I commend the authors for providing a strong methodology.,fine,arg-request_edit,1.0,9,1
4011,- I didn't understand the motivation for testing only very general-purpose models (this is described in Section 3).,fine,none,9.0,9,9
4012,"This is certainly a scientific decision, i.e., the authors are determining which models to use in order to determine the possible insights they will derive.",fine,none,9.0,9,9
4013,But it's not clear to me why testing more sophisticated models that are tailored for math questions would *not* be useful.,fine,arg-request_clarification,0.0,3,0
4014,"In fact, assuming that such methods outperform general-purpose models, we could investigate why and where this is the case (in fact the proposed dataset is very useful for this).",fine,none,9.0,9,9
4015,"On the other hand, if these specialized approaches largely fail to outperform general-purpose models, we would have the opposite insights---that these models' benefits are dataset-specific and thus limited.",fine,none,9.0,9,9
4016,- Really would be good to do real-world tests in a more extensive way.,fine,arg-request_experiment,2.0,2,2
4017,"A 40-question exam for 16 year olds is probably far too challenging for the current state of general recurrent models. Can you add some additional grades here, and more questions?",fine,arg-request_edit,1.0,2,1
4018,"- For the number of thinkings steps, how does it scale up as you increase it from 0 to 16? Is there a clear relationships here?",fine,arg-request_explanation,3.0,3,3
4019,"- The 1+1+...+1 example is pretty intriguing, and could be a nice ""default"" question!",fine,none,9.0,9,9
4020,"- Minor typo: in the abstract: ""test spits"" should be ""test splits""",fine,arg-request_typo,5.0,5,5
4021,Summary:,fine,arg-structuring_heading,6.0,6,6
4022,"This paper proposes Direct Sparse Optimization (DSO)-NAS, which is a method to obtain neural architectures on specific problems, at a reasonable computational cost.",fine,arg-structuring_summary,8.0,8,8
4023,"The main idea is to treat all architectures as a Directed Acyclic Graph (DAG), where each architecture is realized by a subgraph.",fine,arg-structuring_summary,8.0,8,8
4024,"All architectures in the search space thus share their weights, like ENAS (Pham et al 2018) and DARTS (Liu et al 2018a).",fine,arg-structuring_summary,8.0,8,8
4025,The DAG’s edges can be pruned via a sparsity regularization term.,fine,arg-structuring_summary,8.0,8,8
4026,The optimization objective of DSO-NAS is thus:,fine,arg-structuring_summary,8.0,8,8
4027,"Accuracy + L2-regularization(W) + L1-sparsity(\lambda),",fine,arg-structuring_summary,8.0,9,8
4028,where W is the shared weights and \lambda specifies which edges in the DAG are used.,fine,arg-structuring_summary,8.0,8,8
4029,There are 3 phases of optimization:,fine,arg-structuring_summary,8.0,6,8
4030,1. All edges are activated and the shared weights W are trained using normal SGD.,fine,arg-structuring_summary,8.0,8,8
4031,Note that this step does not involve \lambda.,fine,arg-structuring_summary,8.0,9,8
4032,"2. \lambda is trained using Accelerated Proximal Gradient (APG, Huang and Wang 2018).",fine,arg-structuring_summary,8.0,8,8
4033,3. The best architecture is selected and retrained from scratch.,fine,arg-structuring_summary,8.0,8,8
4034,This procedure works for all architectures and objectives.,fine,arg-structuring_summary,8.0,8,8
4035,"However, DSO-NAS further proposes to incorporate the computation expense of architectures into step (2) above, leading to their found architectures having fewer parameters and a smaller FLOP counts.",fine,arg-structuring_summary,8.0,8,8
4036,"Their experiments confirm all the hypotheses (DSO-NAS can find architectures, having small FLOP counts, having good performances on CIFAR-10 and ImageNet).",fine,arg-structuring_summary,8.0,8,8
4037,Strengths:,fine,arg-structuring_heading,6.0,6,6
4038,1. Regularization by sparsity is a neat idea.,fine,none,9.0,9,9
4039,2. The authors claim to be the first NAS algorithm to perform direct search on ImageNet.,fine,arg-structuring_quote,7.0,9,7
4040,"Honestly, I cannot confirm this claim (not sure if I have seen all NAS papers out there), but if it is the case, then it is impressive.",fine,none,9.0,9,9
4041,3. Incorporating architecture costs into the search objective is nice.,fine,none,9.0,9,9
4042,"However, this contribution seems to be orthogonal to the sparsity regularization, which, I suppose, is the main point of the paper.",fine,none,9.0,9,9
4043,Weaknesses:,fine,arg-structuring_heading,6.0,6,6
4044,1. Some experimental details are missing. I’m going to list them here:,fine,arg-structuring_heading,6.0,6,6
